{
  "schema_version": "0.1.0",
  "report_id": "redaction-controlled-research-001",
  "created_at": "2026-06-30T13:00:00Z",
  "policy_version": "example-redaction-0.1.0",
  "input_hash": "sha256:d1c0882d9a801ad4345f09cc3097fd75fa44b03a80039ff91156a961b1f933af",
  "output_hash": "sha256:d1c0882d9a801ad4345f09cc3097fd75fa44b03a80039ff91156a961b1f933af",
  "summary": {
    "risk_score": 0,
    "blocked_findings": 0,
    "redacted_findings": 0,
    "review_required": false
  },
  "findings": [],
  "decision": "controlled_only",
  "notes": "Synthetic fixture contains no real personal data, secrets, private paths, private URLs, or raw platform export."
}
